{"capabilities":[{"id":"catalog-discovery","implemented_source":true,"integrated":false,"packaged":false,"published":false,"qualified":false,"specified":true,"supported":false},{"id":"catalog-ingest","implemented_source":true,"integrated":false,"packaged":false,"published":false,"qualified":false,"specified":true,"supported":false},{"id":"catalog-query","implemented_source":true,"integrated":false,"packaged":false,"published":false,"qualified":false,"specified":true,"supported":false},{"id":"context","implemented_source":true,"integrated":false,"packaged":false,"published":false,"qualified":false,"specified":true,"supported":false},{"id":"retrieval","implemented_source":true,"integrated":false,"packaged":false,"published":false,"qualified":false,"specified":true,"supported":false},{"id":"handoff","implemented_source":true,"integrated":false,"packaged":false,"published":false,"qualified":false,"specified":true,"supported":false},{"id":"space","implemented_source":true,"integrated":false,"packaged":false,"published":false,"qualified":false,"specified":true,"supported":false},{"id":"replay","implemented_source":true,"integrated":false,"packaged":false,"published":false,"qualified":false,"specified":true,"supported":false},{"id":"policy","implemented_source":true,"integrated":false,"packaged":false,"published":false,"qualified":false,"specified":true,"supported":false},{"id":"daemon","implemented_source":true,"integrated":false,"packaged":false,"published":false,"qualified":false,"specified":true,"supported":false},{"id":"effects","implemented_source":true,"integrated":false,"packaged":false,"published":false,"qualified":false,"specified":true,"supported":false},{"id":"extensions","implemented_source":true,"integrated":false,"packaged":false,"published":false,"qualified":false,"specified":true,"supported":false},{"id":"installers","implemented_source":true,"integrated":false,"packaged":false,"published":false,"qualified":false,"specified":true,"supported":false},{"id":"macos","implemented_source":true,"integrated":false,"packaged":false,"published":false,"qualified":false,"specified":true,"supported":false},{"id":"mcp","implemented_source":true,"integrated":false,"packaged":false,"published":false,"qualified":false,"specified":true,"supported":false},{"id":"oci","implemented_source":true,"integrated":false,"packaged":false,"published":false,"qualified":false,"specified":true,"supported":false},{"id":"otlp","implemented_source":true,"integrated":false,"packaged":false,"published":false,"qualified":false,"specified":true,"supported":false},{"id":"plugin","implemented_source":true,"integrated":false,"packaged":false,"published":false,"qualified":false,"specified":true,"supported":false},{"id":"remote","implemented_source":true,"integrated":false,"packaged":false,"published":false,"qualified":false,"specified":true,"supported":false},{"id":"sdk","implemented_source":true,"integrated":false,"packaged":false,"published":false,"qualified":false,"specified":true,"supported":false},{"id":"shared","implemented_source":true,"integrated":false,"packaged":false,"published":false,"qualified":false,"specified":true,"supported":false},{"id":"vector","implemented_source":true,"integrated":false,"packaged":false,"published":false,"qualified":false,"specified":true,"supported":false},{"id":"windows","implemented_source":true,"integrated":false,"packaged":false,"published":false,"qualified":false,"specified":true,"supported":false},{"id":"arm","implemented_source":true,"integrated":false,"packaged":false,"published":false,"qualified":false,"specified":true,"supported":false},{"id":"backup","implemented_source":true,"integrated":false,"packaged":false,"published":false,"qualified":false,"specified":true,"supported":false},{"id":"garbage-collection","implemented_source":true,"integrated":false,"packaged":false,"published":false,"qualified":false,"specified":true,"supported":false},{"id":"diagnostics","implemented_source":true,"integrated":false,"packaged":false,"published":false,"qualified":false,"specified":true,"supported":false},{"id":"serving","implemented_source":true,"integrated":false,"packaged":false,"published":false,"qualified":false,"specified":true,"supported":false},{"id":"completion-man","implemented_source":true,"integrated":false,"packaged":false,"published":false,"qualified":false,"specified":true,"supported":false}],"fail_closed":true,"platform_scope":{"host_arch":"arm64","host_os":"macos","target_triple":"aarch64-apple-darwin"},"profile_id":"cigar.post-beta.macos-arm64.v1","schema_version":"cigar.post-beta.capability-profile.v1","source_capability_policy":{"path":"packaging/beta/capability-policy.v1.json","sha256":"262abc5d6a026ca895a905509436463dc24bd7c60bc94cb42c56978e07c66568"},"state_order":["specified","implemented_source","integrated","packaged","qualified","published","supported"]}
